
<xs:schema xmlns:xs="http://www.w3.org/2001/XMLSchema" elementFormDefault="qualified" attributeFormDefault="unqualified">
	<xs:element name="system.tables_root">
		<xs:complexType>
			<xs:sequence>
				<xs:element name="system.tables" minOccurs="0" maxOccurs="unbounded">
					<xs:complexType>
						<xs:sequence>
							<xs:element name="table_id"  minOccurs="1" maxOccurs="1">
								<xs:simpleType>
									<xs:restriction base = "xs:int"/>
								</xs:simpleType>
							</xs:element>
							<xs:element name="table_name"  minOccurs="1" maxOccurs="1">
								<xs:simpleType>
									<xs:restriction base = "xs:string">
										<xs:minLength value="0"/>
										<xs:maxLength value="128"/>
									</xs:restriction>
								</xs:simpleType>
							</xs:element>
							<xs:element name="table_type"  minOccurs="1" maxOccurs="1">
								<xs:simpleType>
									<xs:restriction base = "xs:string">
										<xs:minLength value="0"/>
										<xs:maxLength value="128"/>
									</xs:restriction>
								</xs:simpleType>
							</xs:element>
							<xs:element name="schema_id"  minOccurs="1" maxOccurs="1">
								<xs:simpleType>
									<xs:restriction base = "xs:int"/>
								</xs:simpleType>
							</xs:element>
							<xs:element name="remarks"  minOccurs="0" maxOccurs="1">
								<xs:simpleType>
									<xs:restriction base = "xs:string">
										<xs:minLength value="0"/>
										<xs:maxLength value="128"/>
									</xs:restriction>
								</xs:simpleType>
							</xs:element>
						</xs:sequence>
					</xs:complexType>
					<xs:key name="XPKsystem.tables">
						<xs:selector xpath=".//system.tables"/>
						<xs:field xpath="table_id"/>
					</xs:key>
				</xs:element>
			</xs:sequence>
		</xs:complexType>
	</xs:element>
</xs:schema>
